{
  "$schema": "https://json-schema.org/draft/2020-12/schema",
  "$id": "rusty.quest.sidecar.manifold_contract_intake_request.v1",
  "title": "Rusty Quest Sidecar Manifold Contract Intake Request",
  "type": "object",
  "required": [
    "schema",
    "request_id",
    "generated_at",
    "request_status",
    "source_handoff_package",
    "request_scope",
    "authority",
    "proposed_contract_intake",
    "hostess_boundary",
    "validation_evidence",
    "privacy_boundary",
    "checks",
    "summary",
    "authority_boundary",
    "next_gate"
  ],
  "properties": {
    "schema": {
      "const": "rusty.quest.sidecar.manifold_contract_intake_request.v1"
    },
    "request_id": {
      "type": "string"
    },
    "generated_at": {
      "type": "string"
    },
    "request_status": {
      "enum": [
        "ready_for_manifold_contract_intake",
        "manual_review",
        "blocked"
      ]
    },
    "source_handoff_package": {
      "type": "object"
    },
    "request_scope": {
      "type": "object"
    },
    "authority": {
      "type": "object"
    },
    "proposed_contract_intake": {
      "type": "object"
    },
    "hostess_boundary": {
      "type": "object"
    },
    "validation_evidence": {
      "type": "object"
    },
    "privacy_boundary": {
      "type": "object"
    },
    "checks": {
      "type": "array",
      "items": {
        "type": "object"
      }
    },
    "summary": {
      "type": "object"
    },
    "authority_boundary": {
      "type": "array",
      "items": {
        "type": "string"
      }
    },
    "next_gate": {
      "type": "string"
    }
  },
  "additionalProperties": false
}
